# name: test/sql/simple_struct_encryption.test
# description: test simple_struct_encryption extension
# group: [vcrypt]

# Before we load the extension, this will fail
statement error
SELECT vcrypt('Test');
----
Catalog Error: Scalar Function with name vcrypt does not exist!

# Require statement will ensure this test is run with this extension loaded
require vcrypt

statement ok
CREATE SECRET key_1 (
	TYPE VCRYPT,
    TOKEN '0123456789112345',
    LENGTH 16
);

statement ok
SELECT encrypt_naive(11, 'key_1');

statement ok
CREATE TABLE test_1 AS SELECT 1 AS value FROM range(10);

statement ok
SELECT encrypt_naive(value, 'key_1') AS encrypted_value FROM test_1;

statement ok
ALTER TABLE test_1 ADD COLUMN encrypted_values STRUCT(nonce_hi UBIGINT, nonce_lo UBIGINT, value INTEGER);

statement ok
ALTER TABLE test_1 ADD COLUMN decrypted_values INTEGER;

statement ok
UPDATE test_1 SET encrypted_values = encrypt_naive(value, 'key_1');

statement ok
UPDATE test_1 SET decrypted_values = decrypt_naive(encrypted_values, 'key_1');

query I
SELECT decrypted_values FROM test_1;
----
1
1
1
1
1
1
1
1
1
1

statement ok
SELECT encrypt_naive('testtest', 'key_1');

statement ok
CREATE TABLE test_varchar AS SELECT CAST('hello' AS VARCHAR) AS value FROM range(10);

statement ok
SELECT encrypt_naive(value, 'key_1') AS encrypted_value FROM test_varchar;

statement ok
ALTER TABLE test_varchar ADD COLUMN encrypted_values STRUCT(nonce_hi UBIGINT, nonce_lo UBIGINT, value VARCHAR);

statement ok
ALTER TABLE test_varchar ADD COLUMN decrypted_values VARCHAR;

statement ok
UPDATE test_varchar SET encrypted_values = encrypt_naive(value, 'key_1');

statement ok
UPDATE test_varchar SET decrypted_values = decrypt_naive(encrypted_values, 'key_1');

query I
SELECT decrypted_values FROM test_varchar;
----
hello
hello
hello
hello
hello
hello
hello
hello
hello
hello
